{
  "run_id": "694e3400c835",
  "started_at": "2026-09-01T11:30:00",
  "finished_at": "2026-09-01T12:24:26",
  "claude_code_version": "2.1.252",
  "plugin_version": "0.45.0",
  "golden_project": "GOLD",
  "mode": "live",
  "units": [
    {
      "stage": "IDEA",
      "workflow": "WF-FEATURE",
      "work_item": "GOLD-FEAT-001",
      "task": "T-001",
      "role": "engineering-director",
      "model": null,
      "execution": {
        "declared": "inline",
        "resolved": null,
        "actual": null
      },
      "isolation": "shared-checkout",
      "artifacts": [],
      "dod": {
        "pass": 1,
        "fail": 0,
        "unsupported": 0,
        "requires_evidence": 1,
        "result": "incomplete",
        "failing": []
      },
      "review": null,
      "rework": 0,
      "replan": 0,
      "escalation": 0,
      "attempts": 0,
      "outcome": "not-run",
      "evidence": "synthetic",
      "evidence_note": "planned from WF-FEATURE and checked for evaluability; no session ran, so the definition of done is unmet rather than failed"
    },
    {
      "stage": "REQ",
      "workflow": "WF-FEATURE",
      "work_item": "GOLD-FEAT-001",
      "task": "T-002",
      "role": "product-manager",
      "model": null,
      "execution": {
        "declared": "subagent",
        "resolved": null,
        "actual": null
      },
      "isolation": "shared-checkout",
      "artifacts": [
        "REQ",
        "NFR"
      ],
      "dod": {
        "pass": 1,
        "fail": 9,
        "unsupported": 0,
        "requires_evidence": 1,
        "result": "incomplete",
        "failing": [
          "artifact_exists(REQ) -- 0 artifact(s) of type REQ",
          "artifact_status(REQ, approved) -- no REQ artifact exists",
          "field_quantified(NFR, target) -- no NFR artifact exists",
          "agent_verdict(qa-lead, pass) -- no recorded pass verdict from qa-lead",
          "required_fields_present(REQ) -- no REQ artifact exists",
          "artifact_owned_by(REQ, requirements-analyst) -- no REQ artifact exists",
          "cycle_accepted(CYCLE-PROD) -- no work item carries a CYCLE-PROD rollup",
          "cycle_rollup_reported(CYCLE-PROD) -- no rollup for CYCLE-PROD. A department that completed without reporting has not finished."
        ]
      },
      "review": {
        "reviewer": "qa-lead",
        "verdict": "not-run",
        "findings": 0
      },
      "rework": 0,
      "replan": 0,
      "escalation": 0,
      "attempts": 0,
      "outcome": "not-run",
      "evidence": "synthetic",
      "evidence_note": "planned from WF-FEATURE and checked for evaluability; no session ran, so the definition of done is unmet rather than failed"
    },
    {
      "stage": "ARCH",
      "workflow": "WF-FEATURE",
      "work_item": "GOLD-FEAT-001",
      "task": "T-003",
      "role": "solution-architect",
      "model": null,
      "execution": {
        "declared": "team",
        "resolved": null,
        "actual": null
      },
      "isolation": "shared-checkout",
      "artifacts": [
        "ARCH",
        "ADR",
        "SEC"
      ],
      "dod": {
        "pass": 1,
        "fail": 11,
        "unsupported": 0,
        "requires_evidence": 2,
        "result": "incomplete",
        "failing": [
          "artifact_exists(ARCH) -- 0 artifact(s) of type ARCH",
          "complexity_justified(ARCH) -- no ARCH artifact exists",
          "every_linked(REQ, ARCH) -- no REQ artifact exists to link from",
          "artifact_status(ADR, accepted) -- no ADR artifact exists",
          "agent_verdict(architecture-reviewer, pass) -- no recorded pass verdict from architecture-reviewer",
          "required_fields_present(ARCH) -- no ARCH artifact exists",
          "artifact_owned_by(ARCH, solution-architect) -- no ARCH artifact exists",
          "artifact_status(ARCH, approved) -- no ARCH artifact exists"
        ]
      },
      "review": {
        "reviewer": "architecture-reviewer",
        "verdict": "not-run",
        "findings": 0
      },
      "rework": 0,
      "replan": 0,
      "escalation": 0,
      "attempts": 0,
      "outcome": "not-run",
      "evidence": "synthetic",
      "evidence_note": "planned from WF-FEATURE and checked for evaluability; no session ran, so the definition of done is unmet rather than failed"
    },
    {
      "stage": "STORY",
      "workflow": "WF-FEATURE",
      "work_item": "GOLD-FEAT-001",
      "task": "T-004",
      "role": "development-lead",
      "model": null,
      "execution": {
        "declared": "inline",
        "resolved": null,
        "actual": null
      },
      "isolation": "shared-checkout",
      "artifacts": [
        "EPIC",
        "STORY"
      ],
      "dod": {
        "pass": 0,
        "fail": 4,
        "unsupported": 0,
        "requires_evidence": 0,
        "result": "incomplete",
        "failing": [
          "artifact_exists(STORY) -- 0 artifact(s) of type STORY",
          "every_linked(STORY, REQ) -- no STORY artifact exists to link from",
          "agent_verdict(qa-lead, pass) -- no recorded pass verdict from qa-lead",
          "required_fields_present(STORY) -- no STORY artifact exists"
        ]
      },
      "review": {
        "reviewer": "qa-lead",
        "verdict": "not-run",
        "findings": 0
      },
      "rework": 0,
      "replan": 0,
      "escalation": 0,
      "attempts": 0,
      "outcome": "not-run",
      "evidence": "synthetic",
      "evidence_note": "planned from WF-FEATURE and checked for evaluability; no session ran, so the definition of done is unmet rather than failed"
    },
    {
      "stage": "QADESIGN",
      "workflow": "WF-FEATURE",
      "work_item": "GOLD-FEAT-001",
      "task": "T-005",
      "role": "qa-lead",
      "model": null,
      "execution": {
        "declared": "subagent",
        "resolved": null,
        "actual": null
      },
      "isolation": "shared-checkout",
      "artifacts": [
        "TP",
        "TEST"
      ],
      "dod": {
        "pass": 0,
        "fail": 4,
        "unsupported": 0,
        "requires_evidence": 0,
        "result": "incomplete",
        "failing": [
          "artifact_exists(TP) -- 0 artifact(s) of type TP",
          "every_linked(REQ, TP) -- no REQ artifact exists to link from",
          "agent_verdict(test-reviewer, pass) -- no recorded pass verdict from test-reviewer",
          "required_fields_present(TP) -- no TP artifact exists"
        ]
      },
      "review": {
        "reviewer": "test-reviewer",
        "verdict": "not-run",
        "findings": 0
      },
      "rework": 0,
      "replan": 0,
      "escalation": 0,
      "attempts": 0,
      "outcome": "not-run",
      "evidence": "synthetic",
      "evidence_note": "planned from WF-FEATURE and checked for evaluability; no session ran, so the definition of done is unmet rather than failed"
    },
    {
      "stage": "DEV",
      "workflow": "WF-FEATURE",
      "work_item": "GOLD-FEAT-001",
      "task": "T-006",
      "role": "development-lead",
      "model": null,
      "execution": {
        "declared": "team",
        "resolved": null,
        "actual": null
      },
      "isolation": "shared-checkout",
      "artifacts": [],
      "dod": {
        "pass": 0,
        "fail": 5,
        "unsupported": 0,
        "requires_evidence": 2,
        "result": "incomplete",
        "failing": [
          "every_linked(STORY, TEST) -- no STORY artifact exists to link from",
          "artifact_status(STORY, done) -- no STORY artifact exists",
          "cycle_accepted(CYCLE-DEV) -- no work item carries a CYCLE-DEV rollup",
          "cycle_rollup_reported(CYCLE-DEV) -- no rollup for CYCLE-DEV. A department that completed without reporting has not finished.",
          "no_open_rework(CYCLE-DEV) -- no work item carries a CYCLE-DEV rollup"
        ]
      },
      "review": null,
      "rework": 0,
      "replan": 0,
      "escalation": 0,
      "attempts": 0,
      "outcome": "not-run",
      "evidence": "synthetic",
      "evidence_note": "planned from WF-FEATURE and checked for evaluability; no session ran, so the definition of done is unmet rather than failed"
    },
    {
      "stage": "REVIEW",
      "workflow": "WF-FEATURE",
      "work_item": "GOLD-FEAT-001",
      "task": "T-007",
      "role": "code-reviewer",
      "model": null,
      "execution": {
        "declared": "subagent",
        "resolved": null,
        "actual": null
      },
      "isolation": "shared-checkout",
      "artifacts": [
        "REVIEW"
      ],
      "dod": {
        "pass": 0,
        "fail": 5,
        "unsupported": 0,
        "requires_evidence": 2,
        "result": "incomplete",
        "failing": [
          "agent_verdict(code-reviewer, pass) -- no recorded pass verdict from code-reviewer",
          "artifact_exists(SEC) -- 0 artifact(s) of type SEC",
          "cycle_accepted(CYCLE-SEC) -- no work item carries a CYCLE-SEC rollup",
          "cycle_rollup_reported(CYCLE-SEC) -- no rollup for CYCLE-SEC. A department that completed without reporting has not finished.",
          "no_open_rework(CYCLE-SEC) -- no work item carries a CYCLE-SEC rollup"
        ]
      },
      "review": {
        "reviewer": "routed reviewers per policies/review-routing.json",
        "verdict": "not-run",
        "findings": 0
      },
      "rework": 0,
      "replan": 0,
      "escalation": 0,
      "attempts": 0,
      "outcome": "not-run",
      "evidence": "synthetic",
      "evidence_note": "planned from WF-FEATURE and checked for evaluability; no session ran, so the definition of done is unmet rather than failed"
    },
    {
      "stage": "CI",
      "workflow": "WF-FEATURE",
      "work_item": "GOLD-FEAT-001",
      "task": "T-008",
      "role": "devops-engineer",
      "model": null,
      "execution": {
        "declared": "inline",
        "resolved": null,
        "actual": null
      },
      "isolation": "shared-checkout",
      "artifacts": [],
      "dod": {
        "pass": 0,